{"$schema":"https://json-schema.org/draft/2020-12/schema","$id":"stage-2-proof-report.schema.json","type":"object","additionalProperties":false,"required":["schema_version","stage1_provenance","slot_count","attempts","deferred_work","next_follow_up","diagnostics","cleanup_disposition","residual_warning"],"properties":{"schema_version":{"const":3},"stage1_provenance":{"type":"object","additionalProperties":false,"required":["report_path","report_sha256","model","base_commit","result_commit"],"properties":{"report_path":{"type":"string","pattern":"^(?!/)(?!.*\\.\\.)[^\\n]+$","maxLength":256},"report_sha256":{"type":"string","pattern":"^[0-9a-f]{64}$"},"model":{"type":"string","maxLength":128},"base_commit":{"type":"string","pattern":"^[0-9a-f]{40}$"},"result_commit":{"type":"string","pattern":"^[0-9a-f]{40}$"}}},"slot_count":{"const":2},"attempts":{"type":"array","minItems":3,"maxItems":3,"items":{"type":"object","additionalProperties":false,"required":["attempt_id","node_id","slot_index","status","builder_model","commit_sha","failure_code","verifier_checks","isolation"],"properties":{"attempt_id":{"type":"string","maxLength":256},"node_id":{"type":"string","maxLength":256},"slot_index":{"type":"integer","minimum":0,"maximum":1},"status":{"enum":["passed","failed"]},"builder_model":{"type":"string","maxLength":128},"commit_sha":{"type":["string","null"],"pattern":"^[0-9a-f]{40}$"},"failure_code":{"type":["string","null"],"maxLength":256},"verifier_checks":{"type":"array","maxItems":128,"items":{"type":"object","additionalProperties":false,"required":["name","passed"],"properties":{"name":{"type":"string","maxLength":128},"passed":{"type":"boolean"}}}},"isolation":{"type":"object","additionalProperties":false,"required":["workspace_commitment","pi_session_commitment","nonce_commitment","result_id_commitment","repository_instance_commitment","private_runtime_commitment","broker_commitment","resource_inventory_commitment","execution_context_commitment","actor_identity_commitment","attempt_contract_commitment","attempt_binding_hash"],"properties":{"workspace_commitment":{"type":"string","pattern":"^[0-9a-f]{64}$"},"pi_session_commitment":{"type":"string","pattern":"^[0-9a-f]{64}$"},"nonce_commitment":{"type":"string","pattern":"^[0-9a-f]{64}$"},"result_id_commitment":{"type":"string","pattern":"^[0-9a-f]{64}$"},"repository_instance_commitment":{"type":"string","pattern":"^[0-9a-f]{64}$"},"private_runtime_commitment":{"type":"string","pattern":"^[0-9a-f]{64}$"},"broker_commitment":{"type":"string","pattern":"^[0-9a-f]{64}$"},"resource_inventory_commitment":{"type":"string","pattern":"^[0-9a-f]{64}$"},"execution_context_commitment":{"type":"string","pattern":"^[0-9a-f]{64}$"},"actor_identity_commitment":{"type":"string","pattern":"^[0-9a-f]{64}$"},"attempt_contract_commitment":{"type":"string","pattern":"^[0-9a-f]{64}$"},"attempt_binding_hash":{"type":"string","pattern":"^[0-9a-f]{64}$"}}}}}},"deferred_work":{"type":"array","items":{"type":"string"}},"next_follow_up":{"type":"string"},"diagnostics":{"type":"object","additionalProperties":false,"required":["started_at","finished_at","timing_points"],"properties":{"started_at":{"type":"string","format":"date-time"},"finished_at":{"type":"string","format":"date-time"},"timing_points":{"type":"array","items":{"type":"object","additionalProperties":false,"required":["label","timestamp"],"properties":{"label":{"type":"string"},"timestamp":{"type":"string","format":"date-time"}}}}}},"cleanup_disposition":{"type":"object","additionalProperties":false,"required":["workspace_removed","session_removed"],"properties":{"workspace_removed":{"type":"boolean"},"session_removed":{"type":"boolean"}}},"residual_warning":{"const":"This controlled fixture proof is not production authorization for arbitrary repositories."}}}
